{"allowed_pair":{"backend_reference":{"backend_id":"schuss-backend-000002","content_hash":"sha256:64194118192a3c61b5c4ca452212832aa64ef538ae63699ac006b9bea5a6bd16","revision":2},"state":{"code":"DIRECT_OPERATION_UNSUPPORTED","rationale":"Task 017 records exact legacy source and seams but does not create a direct operation specification or native realization.","status":"not-evaluated"},"target_reference":{"compute_target_id":"schuss-compute-target-000001","content_hash":"sha256:d8a9652bd079d0f2a8806cc4922f2a380c8092549f267047d5a4a0360b4a6753","revision":2}},"binding_eligibility_id":"schuss-binding-eligibility-000020","binding_reference":{"content_hash":"sha256:02f237a82ee92f47c5b6676ea1819b942728fe873cedd47a124fc32b74dca81b","implementation_id":"schuss-implementation-000054","revision":2},"canonical_profile":"schuss-canonical-json-v1","capability_requirements":[{"capability_key":"audio-stream-fixed-q27","comparison_rule":"exact","value":true},{"capability_key":"control-stream-fixed-q27","comparison_rule":"exact","value":true}],"compatibility_evidence":[{"content_hash":"sha256:aa62a0b5d3c411a70dd74a6edee925bc3570553475a007d6f217f6762b3d79d6","evidence_claim_id":"schuss-evidence-claim-000030","revision":1}],"content_hash":"sha256:e330280f576cfb67302f466db28a12c18192bcdaad89750d6829cc7696fcb285","contract_reference":{"component_contract_id":"schuss-component-contract-000015","content_hash":"sha256:705b8e11c00d985eb8fd010a2d3fd71cb891f00711ad647b0746cdfb90c6ff81","revision":1},"dependency_requirements":[],"realization_form":"generated-legacy-object","required_evidence_level":2,"resource_requirements":[],"revision":1,"schema_version":"binding-eligibility-v0","selection_policy":{"implicit_fallback":false,"policy_id":"schuss-selection-policy-000020","priority":100,"ranking_rule":"higher-explicit-priority","tie_behavior":"ambiguous","version":1},"unresolved_questions":[{"code":"DIRECT_SEMANTICS_UNSPECIFIED","earliest_task":"task-017","owner":"backend-owner","question":"What exact legacy-equivalent direct operation and runtime contract realizes this binding?","question_id":"eligibility-question-000020","rationale":"Source/seam review is not direct behavioral equivalence."}]}
