{"allowed_pair":{"backend_reference":{"backend_id":"schuss-backend-000002","content_hash":"sha256:e30889d5a33fca838086a0f3f8aacdcd065826d64fea396f74bda8aa164ee9db","revision":4},"state":{"evidence_level":2,"evidence_refs":[{"content_hash":"sha256:3032c71970e3d7f1d2c6d31c1d917ab8a43221d763ca2e20ea99f8be16c1bc09","evidence_claim_id":"schuss-evidence-claim-000038","revision":1}],"status":"supported"},"target_reference":{"compute_target_id":"schuss-compute-target-000001","content_hash":"sha256:d8a9652bd079d0f2a8806cc4922f2a380c8092549f267047d5a4a0360b4a6753","revision":2}},"binding_eligibility_id":"schuss-binding-eligibility-000027","binding_reference":{"content_hash":"sha256:e6a94c29f5352f16f1494d5b8d234179455a04751966481048d2a07394da97ea","implementation_id":"schuss-implementation-000090","revision":1},"canonical_profile":"schuss-canonical-json-v1","capability_requirements":[{"capability_key":"audio-stream-fixed-q27","comparison_rule":"exact","value":true},{"capability_key":"control-stream-fixed-q27","comparison_rule":"exact","value":true}],"compatibility_evidence":[{"content_hash":"sha256:3032c71970e3d7f1d2c6d31c1d917ab8a43221d763ca2e20ea99f8be16c1bc09","evidence_claim_id":"schuss-evidence-claim-000038","revision":1}],"content_hash":"sha256:1037ebfbee294d4ca4db4840c7039dfafae0c927cfb3a06f7385560321bc2ee3","contract_reference":{"component_contract_id":"schuss-component-contract-000012","content_hash":"sha256:3f399547dbe7a1a76bdcedc1d1d886ccd49d0620fdbca3fbace6aac0a9d2292c","revision":1},"dependency_requirements":[],"realization_form":"native-cpp","required_evidence_level":2,"resource_requirements":[],"revision":2,"schema_version":"binding-eligibility-v0","selection_policy":{"implicit_fallback":false,"policy_id":"schuss-selection-policy-000027","priority":300,"ranking_rule":"higher-explicit-priority","tie_behavior":"ambiguous","version":1},"unresolved_questions":[]}
