{"allowed_pair":{"backend_reference":{"backend_id":"schuss-backend-000002","content_hash":"sha256:fa20b9c8b5037f46435ab23517609c1111e122189ed92d18a6a2ff7cfb91d37c","revision":1},"state":{"evidence_level":2,"evidence_refs":[{"content_hash":"sha256:d3aa3ef1bb4e0565cb1eb3cbef79b2304b19030410b1fc0086882b749c38846a","evidence_claim_id":"schuss-evidence-claim-000021","revision":1}],"status":"supported"},"target_reference":{"compute_target_id":"schuss-compute-target-000001","content_hash":"sha256:d8a9652bd079d0f2a8806cc4922f2a380c8092549f267047d5a4a0360b4a6753","revision":2}},"binding_eligibility_id":"schuss-binding-eligibility-000011","binding_reference":{"content_hash":"sha256:c77603be2488ccfcf5907b14e4935a103e01b480ad9031a9ca1bef14bcf03f63","implementation_id":"schuss-implementation-000045","revision":2},"canonical_profile":"schuss-canonical-json-v1","capability_requirements":[{"capability_key":"audio-stream-fixed-q27","comparison_rule":"exact","value":true},{"capability_key":"control-stream-fixed-q27","comparison_rule":"exact","value":true}],"compatibility_evidence":[{"content_hash":"sha256:d3aa3ef1bb4e0565cb1eb3cbef79b2304b19030410b1fc0086882b749c38846a","evidence_claim_id":"schuss-evidence-claim-000021","revision":1}],"content_hash":"sha256:d83689129e3f2adfb318a50189941a13fd2a8d39b1b98c4fa62ec2be14187f73","contract_reference":{"component_contract_id":"schuss-component-contract-000007","content_hash":"sha256:6c3bdbe18269794e885c392b3cd40d90c445ed0b207ab4dedb79abe8c28ec410","revision":1},"dependency_requirements":[],"realization_form":"native-cpp","required_evidence_level":2,"resource_requirements":[],"revision":1,"schema_version":"binding-eligibility-v0","selection_policy":{"implicit_fallback":false,"policy_id":"schuss-selection-policy-000011","priority":200,"ranking_rule":"higher-explicit-priority","tie_behavior":"ambiguous","version":1},"unresolved_questions":[]}
