{"allowed_pair":{"backend_reference":{"backend_id":"schuss-backend-000002","content_hash":"sha256:da0b542d3797e95df7bc529875c02a00d891d9195565ab6be73cb561d2cabe05","revision":3},"state":{"evidence_level":2,"evidence_refs":[{"content_hash":"sha256:77dbcd65c85240600bf7978a0d666f599d52994f1ea1d6ee9fa84d1a37e3e004","evidence_claim_id":"schuss-evidence-claim-000024","revision":1}],"status":"supported"},"target_reference":{"compute_target_id":"schuss-compute-target-000001","content_hash":"sha256:d8a9652bd079d0f2a8806cc4922f2a380c8092549f267047d5a4a0360b4a6753","revision":2}},"binding_eligibility_id":"schuss-binding-eligibility-000014","binding_reference":{"content_hash":"sha256:4d946f8fd7e1d29a914b9829a1390e4621ae23c3a866f133f0301bbb2ca40e0a","implementation_id":"schuss-implementation-000048","revision":2},"canonical_profile":"schuss-canonical-json-v1","capability_requirements":[{"capability_key":"audio-stream-fixed-q27","comparison_rule":"exact","value":true},{"capability_key":"control-stream-fixed-q27","comparison_rule":"exact","value":true}],"compatibility_evidence":[{"content_hash":"sha256:77dbcd65c85240600bf7978a0d666f599d52994f1ea1d6ee9fa84d1a37e3e004","evidence_claim_id":"schuss-evidence-claim-000024","revision":1}],"content_hash":"sha256:695bae36994992772b5f6c2f5786825480d3fc18aa46220b6cece014ae6c1d93","contract_reference":{"component_contract_id":"schuss-component-contract-000009","content_hash":"sha256:179c1526ed2bd6d9ad1c6fbfc9caa7abc21f479bef50cf93c8599b5817ca8718","revision":1},"dependency_requirements":[],"realization_form":"native-cpp","required_evidence_level":2,"resource_requirements":[],"revision":3,"schema_version":"binding-eligibility-v0","selection_policy":{"implicit_fallback":false,"policy_id":"schuss-selection-policy-000014","priority":200,"ranking_rule":"higher-explicit-priority","tie_behavior":"ambiguous","version":1},"unresolved_questions":[]}
