{"allowed_pair":{"backend_reference":{"backend_id":"schuss-backend-000003","content_hash":"sha256:c188a702201625cbf32d49976ce54a06194dea89d3815e972e319f4b6199a116","revision":1},"state":{"evidence_level":2,"evidence_refs":[{"content_hash":"sha256:211ae1454d0d1a145d8d5689da1fce91825a3c266d058b603c21cbf5b26d3f6c","evidence_claim_id":"schuss-evidence-claim-000075","revision":1}],"status":"supported"},"target_reference":{"compute_target_id":"schuss-compute-target-000002","content_hash":"sha256:8e66c6e40db0215c69c44852f6838a289342f372379262b87acc4a2bb49bd290","revision":1}},"binding_eligibility_id":"schuss-binding-eligibility-000048","binding_reference":{"content_hash":"sha256:e928bf31a0b4427d6c960d4a0d29b181912aa20635ff244673d784e3f66a413f","implementation_id":"schuss-implementation-000162","revision":2},"canonical_profile":"schuss-canonical-json-v1","capability_requirements":[{"capability_key":"audio-stream-fixed-q27","comparison_rule":"exact","value":true},{"capability_key":"control-stream-fixed-q27","comparison_rule":"exact","value":true}],"compatibility_evidence":[{"content_hash":"sha256:211ae1454d0d1a145d8d5689da1fce91825a3c266d058b603c21cbf5b26d3f6c","evidence_claim_id":"schuss-evidence-claim-000075","revision":1}],"content_hash":"sha256:a800de2f6c02856878501bc3e1647fce76b3d4032baa2110d661a0ea222aafe7","contract_reference":{"component_contract_id":"schuss-component-contract-000012","content_hash":"sha256:3f399547dbe7a1a76bdcedc1d1d886ccd49d0620fdbca3fbace6aac0a9d2292c","revision":1},"dependency_requirements":[],"realization_form":"native-cpp","required_evidence_level":2,"resource_requirements":[],"revision":1,"schema_version":"binding-eligibility-v0","selection_policy":{"implicit_fallback":false,"policy_id":"schuss-selection-policy-000048","priority":500,"ranking_rule":"higher-explicit-priority","tie_behavior":"ambiguous","version":1},"unresolved_questions":[]}
