{"allowed_pair":{"backend_reference":{"backend_id":"schuss-backend-000002","content_hash":"sha256:64194118192a3c61b5c4ca452212832aa64ef538ae63699ac006b9bea5a6bd16","revision":2},"state":{"code":"DIRECT_OPERATION_UNSUPPORTED","rationale":"Task 017 records exact legacy source and seams but does not create a direct operation specification or native realization.","status":"not-evaluated"},"target_reference":{"compute_target_id":"schuss-compute-target-000001","content_hash":"sha256:d8a9652bd079d0f2a8806cc4922f2a380c8092549f267047d5a4a0360b4a6753","revision":2}},"binding_eligibility_id":"schuss-binding-eligibility-000022","binding_reference":{"content_hash":"sha256:557d92e91309137e332432acd370f594392c45cffa628f83d98be754accf0574","implementation_id":"schuss-implementation-000056","revision":2},"canonical_profile":"schuss-canonical-json-v1","capability_requirements":[{"capability_key":"audio-stream-fixed-q27","comparison_rule":"exact","value":true},{"capability_key":"control-stream-fixed-q27","comparison_rule":"exact","value":true}],"compatibility_evidence":[{"content_hash":"sha256:5a5310f5d8b69f40dc80dda8e51dcdc188a1ff940bc8f688ed4b0812e9c66405","evidence_claim_id":"schuss-evidence-claim-000032","revision":1}],"content_hash":"sha256:d830030d025c82e9be0e0902b97e89a59242f52900b679559e07fb82fd4fa001","contract_reference":{"component_contract_id":"schuss-component-contract-000017","content_hash":"sha256:7bc2c3561f38bd72660fc2de9dadb97418e5ecb81db280accfe55fb8a69b8ea8","revision":1},"dependency_requirements":[{"dependency_id":"rings-fx-header","portable_locator":"sha256/3da1acbf013cd4d7c2a105c95d99e19b0b1c173addc24dc2f79af85523d0a55b","state":{"evidence_refs":["legacy-resolved-catalog-v0:object:174"],"status":"supported"}}],"realization_form":"legacy-native-object","required_evidence_level":2,"resource_requirements":[{"alignment_bytes":4,"amount_bytes":32768,"region_id":"target-memory-region-000005","requirement_id":"binding-resource-requirement-000001","resource_kind":"data","state":{"code":"DIRECT_RESOURCE_NOT_EVALUATED","rationale":"The legacy source requests 32768 bytes, but Task 017 does not prove a direct runtime allocation contract.","status":"not-evaluated"}}],"revision":1,"schema_version":"binding-eligibility-v0","selection_policy":{"implicit_fallback":false,"policy_id":"schuss-selection-policy-000022","priority":100,"ranking_rule":"higher-explicit-priority","tie_behavior":"ambiguous","version":1},"unresolved_questions":[{"code":"DIRECT_SEMANTICS_UNSPECIFIED","earliest_task":"task-017","owner":"backend-owner","question":"What exact legacy-equivalent direct operation and runtime contract realizes this binding?","question_id":"eligibility-question-000022","rationale":"Source/seam review is not direct behavioral equivalence."}]}
