{"allowed_pair":{"backend_reference":{"backend_id":"schuss-backend-000002","content_hash":"sha256:64194118192a3c61b5c4ca452212832aa64ef538ae63699ac006b9bea5a6bd16","revision":2},"state":{"code":"DIRECT_OPERATION_UNSUPPORTED","rationale":"Task 017 records exact legacy source and seams but does not create a direct operation specification or native realization.","status":"not-evaluated"},"target_reference":{"compute_target_id":"schuss-compute-target-000001","content_hash":"sha256:d8a9652bd079d0f2a8806cc4922f2a380c8092549f267047d5a4a0360b4a6753","revision":2}},"binding_eligibility_id":"schuss-binding-eligibility-000023","binding_reference":{"content_hash":"sha256:4a7dfb169e3c1723b290f55df1672113a2c02efed7a98f578a43b3d4251df62d","implementation_id":"schuss-implementation-000057","revision":2},"canonical_profile":"schuss-canonical-json-v1","capability_requirements":[{"capability_key":"audio-stream-fixed-q27","comparison_rule":"exact","value":true},{"capability_key":"control-stream-fixed-q27","comparison_rule":"exact","value":true}],"compatibility_evidence":[{"content_hash":"sha256:b6ec3d263fb05783c1ac5ef2af5dfc56ae697e4c165e95e57185c657eea9094b","evidence_claim_id":"schuss-evidence-claim-000033","revision":1}],"content_hash":"sha256:138029543953268e5773bc14b565c3c61965fd69fe508e74ff1253c2e6ab2de9","contract_reference":{"component_contract_id":"schuss-component-contract-000018","content_hash":"sha256:5487dab7231dab7e3453b8eba4af2e95caaa55a491692c42624277f1aa89d3c4","revision":1},"dependency_requirements":[{"dependency_id":"brds-digital-header","portable_locator":"sha256/e132f0d876ea54c26f301e448f1c079243433aaa7acf7743a35c928e9c3d95c4","state":{"evidence_refs":["legacy-resolved-catalog-v0:object:527"],"status":"supported"}}],"realization_form":"legacy-native-object","required_evidence_level":2,"resource_requirements":[],"revision":1,"schema_version":"binding-eligibility-v0","selection_policy":{"implicit_fallback":false,"policy_id":"schuss-selection-policy-000023","priority":100,"ranking_rule":"higher-explicit-priority","tie_behavior":"ambiguous","version":1},"unresolved_questions":[{"code":"DIRECT_SEMANTICS_UNSPECIFIED","earliest_task":"task-017","owner":"backend-owner","question":"What exact legacy-equivalent direct operation and runtime contract realizes this binding?","question_id":"eligibility-question-000023","rationale":"Source/seam review is not direct behavioral equivalence."}]}
