{"allowed_pair":{"backend_reference":{"backend_id":"schuss-backend-000002","content_hash":"sha256:64194118192a3c61b5c4ca452212832aa64ef538ae63699ac006b9bea5a6bd16","revision":2},"state":{"evidence_level":2,"evidence_refs":[{"content_hash":"sha256:2d66ff9c37377b4ae46f304f94a0e1313416f4c656fbddceeda6670581ef4133","evidence_claim_id":"schuss-evidence-claim-000022","revision":1}],"status":"supported"},"target_reference":{"compute_target_id":"schuss-compute-target-000001","content_hash":"sha256:d8a9652bd079d0f2a8806cc4922f2a380c8092549f267047d5a4a0360b4a6753","revision":2}},"binding_eligibility_id":"schuss-binding-eligibility-000012","binding_reference":{"content_hash":"sha256:aca4b409000c26d32bd0177ad7328e55ba3bf1ec0989c031ec4eb44f8a8d65df","implementation_id":"schuss-implementation-000046","revision":2},"canonical_profile":"schuss-canonical-json-v1","capability_requirements":[{"capability_key":"audio-stream-fixed-q27","comparison_rule":"exact","value":true},{"capability_key":"control-stream-fixed-q27","comparison_rule":"exact","value":true}],"compatibility_evidence":[{"content_hash":"sha256:2d66ff9c37377b4ae46f304f94a0e1313416f4c656fbddceeda6670581ef4133","evidence_claim_id":"schuss-evidence-claim-000022","revision":1}],"content_hash":"sha256:5e23133d13e516925a02d3a73d2646208b599968b05dd1e71f9ceb2a24c71bb4","contract_reference":{"component_contract_id":"schuss-component-contract-000003","content_hash":"sha256:96a29faf58769be5f2ac52de07aa80cae3dcdff28f0f3c158fb1fd12cc234a8d","revision":1},"dependency_requirements":[],"realization_form":"native-cpp","required_evidence_level":2,"resource_requirements":[],"revision":2,"schema_version":"binding-eligibility-v0","selection_policy":{"implicit_fallback":false,"policy_id":"schuss-selection-policy-000012","priority":200,"ranking_rule":"higher-explicit-priority","tie_behavior":"ambiguous","version":1},"unresolved_questions":[]}
