{"allowed_pair":{"backend_reference":{"backend_id":"schuss-backend-000001","content_hash":"sha256:5dca1a744c001a62b01c5f9b8235e7a9beba41dc90bcfef84b0362ba38b74b87","revision":3},"state":{"evidence_level":2,"evidence_refs":[{"content_hash":"sha256:159ea9c70e2915ede2c4a1d64ca117cbecc163ecce4781bc25dcfe2c748a9705","evidence_claim_id":"schuss-evidence-claim-000007","revision":1}],"status":"supported"},"target_reference":{"compute_target_id":"schuss-compute-target-000001","content_hash":"sha256:d8a9652bd079d0f2a8806cc4922f2a380c8092549f267047d5a4a0360b4a6753","revision":2}},"binding_eligibility_id":"schuss-binding-eligibility-000002","binding_reference":{"content_hash":"sha256:d88ffa76e1435ea9eafc1c263260920b1b29a65a624403ee52531fa678c698b6","implementation_id":"schuss-implementation-000039","revision":2},"canonical_profile":"schuss-canonical-json-v1","capability_requirements":[{"capability_key":"audio-stream-fixed-q27","comparison_rule":"exact","value":true},{"capability_key":"control-stream-fixed-q27","comparison_rule":"exact","value":true}],"compatibility_evidence":[{"content_hash":"sha256:159ea9c70e2915ede2c4a1d64ca117cbecc163ecce4781bc25dcfe2c748a9705","evidence_claim_id":"schuss-evidence-claim-000007","revision":1}],"content_hash":"sha256:4bfbf58635704e761710f0814ab61858dda152a5e50f603750bbec6d11133512","contract_reference":{"component_contract_id":"schuss-component-contract-000004","content_hash":"sha256:987acb05ac5334d69a87af584395d3d9728a2e566d8f932d7767176324701877","revision":1},"dependency_requirements":[],"realization_form":"generated-legacy-object","required_evidence_level":2,"resource_requirements":[],"revision":2,"schema_version":"binding-eligibility-v0","selection_policy":{"implicit_fallback":false,"policy_id":"schuss-selection-policy-000002","priority":100,"ranking_rule":"higher-explicit-priority","tie_behavior":"ambiguous","version":1},"unresolved_questions":[]}
