{"allowed_pair":{"backend_reference":{"backend_id":"schuss-backend-000002","content_hash":"sha256:da0b542d3797e95df7bc529875c02a00d891d9195565ab6be73cb561d2cabe05","revision":3},"state":{"evidence_level":2,"evidence_refs":[{"content_hash":"sha256:00013daa664be9284a53ccbcb4a7018fff91280a8e81b6c8b5f3e9f79d7d4666","evidence_claim_id":"schuss-evidence-claim-000039","revision":1}],"status":"supported"},"target_reference":{"compute_target_id":"schuss-compute-target-000001","content_hash":"sha256:d8a9652bd079d0f2a8806cc4922f2a380c8092549f267047d5a4a0360b4a6753","revision":2}},"binding_eligibility_id":"schuss-binding-eligibility-000028","binding_reference":{"content_hash":"sha256:9bed58ac86efdc133deb600d4cf1bbd41e257a1dece609173a0e867081e57683","implementation_id":"schuss-implementation-000091","revision":1},"canonical_profile":"schuss-canonical-json-v1","capability_requirements":[{"capability_key":"audio-stream-fixed-q27","comparison_rule":"exact","value":true},{"capability_key":"control-stream-fixed-q27","comparison_rule":"exact","value":true}],"compatibility_evidence":[{"content_hash":"sha256:00013daa664be9284a53ccbcb4a7018fff91280a8e81b6c8b5f3e9f79d7d4666","evidence_claim_id":"schuss-evidence-claim-000039","revision":1}],"content_hash":"sha256:df8792ecee6101b02315f77940253b37b5098d37db43e4bd8d147480c3b17335","contract_reference":{"component_contract_id":"schuss-component-contract-000013","content_hash":"sha256:2c4d15d5228dadfbf9c5ecb8734e7207b7157fc8960fb4100b461b59f859daa0","revision":1},"dependency_requirements":[],"realization_form":"native-cpp","required_evidence_level":2,"resource_requirements":[],"revision":1,"schema_version":"binding-eligibility-v0","selection_policy":{"implicit_fallback":false,"policy_id":"schuss-selection-policy-000028","priority":300,"ranking_rule":"higher-explicit-priority","tie_behavior":"ambiguous","version":1},"unresolved_questions":[]}
