{"allowed_pair":{"backend_reference":{"backend_id":"schuss-backend-000002","content_hash":"sha256:fa20b9c8b5037f46435ab23517609c1111e122189ed92d18a6a2ff7cfb91d37c","revision":1},"state":{"evidence_level":2,"evidence_refs":[{"content_hash":"sha256:f7e237b9dca0a13b890503d95bc5c1097cefc8a5107c1eb27c057f82d32d3d2e","evidence_claim_id":"schuss-evidence-claim-000019","revision":1}],"status":"supported"},"target_reference":{"compute_target_id":"schuss-compute-target-000001","content_hash":"sha256:d8a9652bd079d0f2a8806cc4922f2a380c8092549f267047d5a4a0360b4a6753","revision":2}},"binding_eligibility_id":"schuss-binding-eligibility-000009","binding_reference":{"content_hash":"sha256:4d244fa1d048fa8b63b9c5141620b6a02182c31f2a56f896758aa09c90b2f389","implementation_id":"schuss-implementation-000043","revision":2},"canonical_profile":"schuss-canonical-json-v1","capability_requirements":[{"capability_key":"audio-stream-fixed-q27","comparison_rule":"exact","value":true},{"capability_key":"control-stream-fixed-q27","comparison_rule":"exact","value":true}],"compatibility_evidence":[{"content_hash":"sha256:f7e237b9dca0a13b890503d95bc5c1097cefc8a5107c1eb27c057f82d32d3d2e","evidence_claim_id":"schuss-evidence-claim-000019","revision":1}],"content_hash":"sha256:90f3e324495f21cc760a58eecad03493ed240857b238558ca4990cbb95dee4a7","contract_reference":{"component_contract_id":"schuss-component-contract-000005","content_hash":"sha256:09e0ccff23775d0b01b8792aa92f370fb3f741d7baa541eb92123bcfcbf871e1","revision":1},"dependency_requirements":[],"realization_form":"native-cpp","required_evidence_level":2,"resource_requirements":[],"revision":1,"schema_version":"binding-eligibility-v0","selection_policy":{"implicit_fallback":false,"policy_id":"schuss-selection-policy-000009","priority":200,"ranking_rule":"higher-explicit-priority","tie_behavior":"ambiguous","version":1},"unresolved_questions":[]}
