{"allowed_pair":{"backend_reference":{"backend_id":"schuss-backend-000002","content_hash":"sha256:e30889d5a33fca838086a0f3f8aacdcd065826d64fea396f74bda8aa164ee9db","revision":4},"state":{"evidence_level":2,"evidence_refs":[{"content_hash":"sha256:627cfb0dd63fe8f2090613c5a757f65206131899dd85fc9913bf4904759165b0","evidence_claim_id":"schuss-evidence-claim-000048","revision":1}],"status":"supported"},"target_reference":{"compute_target_id":"schuss-compute-target-000001","content_hash":"sha256:d8a9652bd079d0f2a8806cc4922f2a380c8092549f267047d5a4a0360b4a6753","revision":2}},"binding_eligibility_id":"schuss-binding-eligibility-000036","binding_reference":{"content_hash":"sha256:cbf45052ddf8c7ac3fb77150225b4dde5e0472b67c6be2450598b0184f30ff5a","implementation_id":"schuss-implementation-000100","revision":1},"canonical_profile":"schuss-canonical-json-v1","capability_requirements":[{"capability_key":"audio-stream-fixed-q27","comparison_rule":"exact","value":true},{"capability_key":"control-stream-fixed-q27","comparison_rule":"exact","value":true}],"compatibility_evidence":[{"content_hash":"sha256:627cfb0dd63fe8f2090613c5a757f65206131899dd85fc9913bf4904759165b0","evidence_claim_id":"schuss-evidence-claim-000048","revision":1}],"content_hash":"sha256:fc1c6743e7d2709875be474156d7b98e928f3f26216144504c68d13335102338","contract_reference":{"component_contract_id":"schuss-component-contract-000018","content_hash":"sha256:5487dab7231dab7e3453b8eba4af2e95caaa55a491692c42624277f1aa89d3c4","revision":1},"dependency_requirements":[{"dependency_id":"brds-digital-header","portable_locator":"sha256/e132f0d876ea54c26f301e448f1c079243433aaa7acf7743a35c928e9c3d95c4","state":{"evidence_refs":["legacy-resolved-catalog-v0:object:527"],"status":"supported"}}],"realization_form":"native-cpp","required_evidence_level":2,"resource_requirements":[],"revision":1,"schema_version":"binding-eligibility-v0","selection_policy":{"implicit_fallback":false,"policy_id":"schuss-selection-policy-000036","priority":400,"ranking_rule":"higher-explicit-priority","tie_behavior":"ambiguous","version":1},"unresolved_questions":[]}
