{"allowed_pair":{"backend_reference":{"backend_id":"schuss-backend-000002","content_hash":"sha256:64194118192a3c61b5c4ca452212832aa64ef538ae63699ac006b9bea5a6bd16","revision":2},"state":{"evidence_level":2,"evidence_refs":[{"content_hash":"sha256:4c2b195b8c1e154958897f74edd940a630f2257d84a63fe8bf290abecd3240bb","evidence_claim_id":"schuss-evidence-claim-000023","revision":1}],"status":"supported"},"target_reference":{"compute_target_id":"schuss-compute-target-000001","content_hash":"sha256:d8a9652bd079d0f2a8806cc4922f2a380c8092549f267047d5a4a0360b4a6753","revision":2}},"binding_eligibility_id":"schuss-binding-eligibility-000013","binding_reference":{"content_hash":"sha256:0367a8e77ed05eb57ca281eea92dea28e083f0f24021755b5817d7dde4d87a8a","implementation_id":"schuss-implementation-000047","revision":2},"canonical_profile":"schuss-canonical-json-v1","capability_requirements":[{"capability_key":"audio-stream-fixed-q27","comparison_rule":"exact","value":true},{"capability_key":"control-stream-fixed-q27","comparison_rule":"exact","value":true}],"compatibility_evidence":[{"content_hash":"sha256:4c2b195b8c1e154958897f74edd940a630f2257d84a63fe8bf290abecd3240bb","evidence_claim_id":"schuss-evidence-claim-000023","revision":1}],"content_hash":"sha256:80a8c7d94ac73b9c722f50e2ad2b03e119e9a975fc0928fcaae1e75c7411875f","contract_reference":{"component_contract_id":"schuss-component-contract-000008","content_hash":"sha256:b4a4f03947665ff8d100371427d886b7217fcc68199f3b164f8c1ca37cdd1c77","revision":1},"dependency_requirements":[],"realization_form":"native-cpp","required_evidence_level":2,"resource_requirements":[],"revision":2,"schema_version":"binding-eligibility-v0","selection_policy":{"implicit_fallback":false,"policy_id":"schuss-selection-policy-000013","priority":200,"ranking_rule":"higher-explicit-priority","tie_behavior":"ambiguous","version":1},"unresolved_questions":[]}
