{"allowed_pair":{"backend_reference":{"backend_id":"schuss-backend-000002","content_hash":"sha256:e30889d5a33fca838086a0f3f8aacdcd065826d64fea396f74bda8aa164ee9db","revision":4},"state":{"evidence_level":2,"evidence_refs":[{"content_hash":"sha256:c54db2af2f35ea6e610f5e65f9835b2fe4bfe1fca3a3857a962c4d4521f52b08","evidence_claim_id":"schuss-evidence-claim-000057","revision":1}],"status":"supported"},"target_reference":{"compute_target_id":"schuss-compute-target-000001","content_hash":"sha256:d8a9652bd079d0f2a8806cc4922f2a380c8092549f267047d5a4a0360b4a6753","revision":2}},"binding_eligibility_id":"schuss-binding-eligibility-000045","binding_reference":{"content_hash":"sha256:a846d7f7ce84263b4209c9bc95ed4f36ff886eb49cfac4f41feacab0a3678999","implementation_id":"schuss-implementation-000109","revision":1},"canonical_profile":"schuss-canonical-json-v1","capability_requirements":[{"capability_key":"audio-stream-fixed-q27","comparison_rule":"exact","value":true},{"capability_key":"control-stream-fixed-q27","comparison_rule":"exact","value":true}],"compatibility_evidence":[{"content_hash":"sha256:c54db2af2f35ea6e610f5e65f9835b2fe4bfe1fca3a3857a962c4d4521f52b08","evidence_claim_id":"schuss-evidence-claim-000057","revision":1}],"content_hash":"sha256:fc59a5d236b88033d353f5af521938b0ea5efcdeccaa93fd594275cfc58c40ab","contract_reference":{"component_contract_id":"schuss-component-contract-000029","content_hash":"sha256:2dd30b99dac2a5fbca5317107d825fab71d02760f4a737a5d547f0b3d5e7ebea","revision":1},"dependency_requirements":[],"realization_form":"native-cpp","required_evidence_level":2,"resource_requirements":[],"revision":1,"schema_version":"binding-eligibility-v0","selection_policy":{"implicit_fallback":false,"policy_id":"schuss-selection-policy-000045","priority":400,"ranking_rule":"higher-explicit-priority","tie_behavior":"ambiguous","version":1},"unresolved_questions":[]}
