{"allowed_pair":{"backend_reference":{"backend_id":"schuss-backend-000002","content_hash":"sha256:e30889d5a33fca838086a0f3f8aacdcd065826d64fea396f74bda8aa164ee9db","revision":4},"state":{"evidence_level":2,"evidence_refs":[{"content_hash":"sha256:9474ebe91e11ae5ee52f211332f854151168bdbcfe1ed3fbde7aae024c7ea727","evidence_claim_id":"schuss-evidence-claim-000045","revision":1}],"status":"supported"},"target_reference":{"compute_target_id":"schuss-compute-target-000001","content_hash":"sha256:d8a9652bd079d0f2a8806cc4922f2a380c8092549f267047d5a4a0360b4a6753","revision":2}},"binding_eligibility_id":"schuss-binding-eligibility-000033","binding_reference":{"content_hash":"sha256:447788744ab2fc15e2c8ebfb5364d05884cee27ab49ed286a587d0d858c87438","implementation_id":"schuss-implementation-000097","revision":1},"canonical_profile":"schuss-canonical-json-v1","capability_requirements":[{"capability_key":"audio-stream-fixed-q27","comparison_rule":"exact","value":true},{"capability_key":"control-stream-fixed-q27","comparison_rule":"exact","value":true}],"compatibility_evidence":[{"content_hash":"sha256:9474ebe91e11ae5ee52f211332f854151168bdbcfe1ed3fbde7aae024c7ea727","evidence_claim_id":"schuss-evidence-claim-000045","revision":1}],"content_hash":"sha256:cc4a48bb3edaa43881f915818e59e382563e31c9bbb6588cda14d933e00d1c3d","contract_reference":{"component_contract_id":"schuss-component-contract-000014","content_hash":"sha256:4106dca5893ccbd687374c49552d24b2957a63763c48b1d3d4c670cbdb642e08","revision":1},"dependency_requirements":[],"realization_form":"native-cpp","required_evidence_level":2,"resource_requirements":[],"revision":1,"schema_version":"binding-eligibility-v0","selection_policy":{"implicit_fallback":false,"policy_id":"schuss-selection-policy-000033","priority":400,"ranking_rule":"higher-explicit-priority","tie_behavior":"ambiguous","version":1},"unresolved_questions":[]}
